query_id,query,docid,passage,label,query_len,passage_len,difficulty,lexical_overlap
2061,Какая столица Абхазии?,31098#20,"Республика Абхазия Город Сухум — столица республики, имеет статус города республиканского значения, отдельного от одноимённого района. По состоянию на октябрь 2012 года в Абхазии расположено 8 городов и 105 сёл.",1,3,30,0.4235,0.03125
3539,Кто автор слов гимна Израиля?,43331#0,"Имбер, Нафтали Герц Нафтали Герц Имбер (1856, Золочев, Королевство Галиции и Лодомерии, Австро-Венгрия — 8 октября 1909, Нью-Йорк) — еврейский поэт, автор текста «Ха-Тиквы» — гимна сионистского движения, а с 1948 года государственного гимна Израиля.",1,5,35,0.4237575757575758,0.06060606060606061
448,"Что означает название ""Алма-Ата""?",14373#11,Алма-Ата C 1993 года в связи с переименованием в официальном употреблении государственными органами Казахстана на русском и казахском языках город называется «Алматы́». Название «Алматы» переводится как «Яблоневый».,1,4,27,0.4238068965517242,0.034482758620689655
6043,В каком году началась Гражданская война в США?,54022#0,"Гражданская война в США Гражданская война в США (""Война Севера и Юга""; ) — гражданская война 1861—1865 годов между Союзом 20 нерабовладельческих штатов и 4 пограничных штата Севера, с одной стороны, и Конфедерацией 11 рабовладельческих штатов Юга.",1,8,37,0.42410000000000003,0.09375
5216,"Что такое стандарт ""Юникод""?",13025#0,"Юникод Юнико́д (чаще всего) или Унико́д () — стандарт кодирования символов, включающий в себя знаки почти всех письменных языков мира. В настоящее время стандарт является доминирующим в Интернете.",1,4,28,0.4241142857142857,0.03571428571428571
4500,Когда возникла Чувашская письменность?,50271#5,"Чувашская письменность В период старочувашской письменности (XVIII век — 1871 год) для записи чувашской речи использовался русский алфавит без добавления специальных букв для звуков, характерных для чувашской речи.",1,4,28,0.4241142857142857,0.03571428571428571
2340,Протекают ли реки  у города Ливны?,13994#2,"Ливны Своё название город Ливны получил от названия рек, у слияния которых был изначально основан. Это Ливна Полевая и Ливна Лесная.",1,6,21,0.42413333333333336,0.041666666666666664
1155,Какой государственный язык Армении в 2019 году?,29882#1,"Армянский язык Государственный язык Армении и непризнанного государства НКР. Общее число говорящих по всему миру — около 5,9 — 6,7 млн. человек. Согласно исследованиям Массачусетского технологического института, армянский язык — один из 50 наиболее влиятельных языков мира.",1,7,37,0.4242666666666667,0.08333333333333333
1670,Когда была открыта Московская консерватория?,59204#6,"Московская государственная консерватория имени П. И. Чайковского Консерватория в Москве была основана в 1866 году, торжественное открытие состоялось 1 сентября. Главным инициатором создания консерватории был Н. Г. Рубинштейн, соучредителем — князь Николай Петрович Трубецкой.",1,5,34,0.4243428571428572,0.05714285714285714
5564,Какая длина Китайской стены?,89662#0,"Великая Китайская стена Великая Китайская стена ( или ) — разделительная стена длиной почти 9000 км (полная длина — 21,2 тыс. км), построенная в древнем Китае. Крупнейший памятник архитектуры.",1,4,29,0.42438518518518525,0.037037037037037035
2556,Какая длина китайской стены?,89662#0,"Великая Китайская стена Великая Китайская стена ( или ) — разделительная стена длиной почти 9000 км (полная длина — 21,2 тыс. км), построенная в древнем Китае. Крупнейший памятник архитектуры.",1,4,29,0.42438518518518525,0.037037037037037035
5660,Когда родился Видкун Абрахам Лёуриц Йонссён Квислинг?,85365#0,"Квислинг, Видкун Видкун Абрахам Лёуриц Йонссён Квислинг (, 18 июля 1887, Фюресдал, Телемарк, Норвегия — 24 октября 1945, Осло, Норвегия) — норвежский политический и государственный деятель, офицер, дипломат, национал-социалист, глава норвежского правительства после оккупации Норвегии германскими войсками в период Второй мировой войны.",1,7,42,0.4243906976744186,0.09302325581395349
2192,В честь кого назван город Пушкин?,46524#30,"Пушкин (город) 10 февраля 1937 года, в связи со 100-летней годовщиной гибели поэта, ЦИК СССР издает постановление о переименовании города в город Пушкин. 10 июня 1939 года был взорван Екатерининский собор.",1,6,31,0.4245575757575758,0.06060606060606061
841,Сколько кафедр в МГУ на сегодняшний день?,7253#3,"Московский государственный университет Университет включает в себя 15 научно-исследовательских институтов, 43 факультета, более 300 кафедр и 6 филиалов (в их числе пять зарубежных — все в странах СНГ).",1,7,28,0.42459354838709684,0.06451612903225806
5799,"Когда была написана ""Повесть о полку Игрореве""?",50147#1,"Слово о полку Игореве «Слово» было написано, предположительно, в конце XII века, вскоре после описываемого события (часто датируется тем же 1185 годом, реже — 1-2 годами позже).",1,7,27,0.4246,0.0625
650,"Когда была написана ""Песнь о полку игореве""?",50147#1,"Слово о полку Игореве «Слово» было написано, предположительно, в конце XII века, вскоре после описываемого события (часто датируется тем же 1185 годом, реже — 1-2 годами позже).",1,7,27,0.4246,0.0625
4314,Когда было написано «Сло́во о полку́ И́гореве»?,50147#1,"Слово о полку Игореве «Слово» было написано, предположительно, в конце XII века, вскоре после описываемого события (часто датируется тем же 1185 годом, реже — 1-2 годами позже).",1,7,27,0.4246,0.0625
4693,Что такое Евклидовое пространство?,4620#0,"Евклидово пространство Евкли́дово простра́нство (также эвкли́дово простра́нство) — в изначальном смысле, пространство, свойства которого описываются аксиомами евклидовой геометрии. В этом случае предполагается, что пространство имеет размерность, равную 3.",1,4,28,0.4246068965517242,0.034482758620689655
45,Как звали мать Персефоны?,13186#8,"Персефона В некоторых источниках сказано, что Персефона во время нахождения на Олимпе каждое утро поднималась на небо и становилась созвездием Дева, чтобы мать Деметра её могла видеть отовсюду.",1,4,28,0.4246068965517242,0.034482758620689655
4724,Кто такой генерал-аншеф?,53505#0,Генерал-аншеф Генера́л-анше́ф () — воинское звание и чин в вооружённых силах некоторых государств и стран мира.,1,3,16,0.4248,0.0
5239,Сколько живет медоно́сная пчела́?,81416#28,"Медоносная пчела Пчелиные матки живут до пяти лет, редко до восьми.",1,4,11,0.4248,0.0
2221,Когда умер Ярослав Мудрый?,50103#0,"Ярослав Владимирович Мудрый Яросла́в Влади́мирович (в поздней историографической традиции Яросла́в Му́дрый; 978 — 20 февраля 1054, Вышгород) — князь ростовский (987—1010), князь новгородский (1010—1034), великий князь киевский (1016—1018, 1019—1054).",1,4,29,0.42491428571428574,0.03571428571428571
1870,Где умер Рене Генон?,85976#0,"Генон, Рене Рене́ Жан-Мари-Жозеф Гено́н (; 15 ноября 1886, Блуа, Франция — 7 января 1951, Каир, Египет) — французский философ, автор трудов по метафизике, традиционализму, символизму и инициации.",1,4,28,0.4250666666666667,0.03333333333333333
4324,Когда произошла Октябрьская революция в России?,9#65,"Россия 25 октября (7 ноября) 1917 года произошла Октябрьская революция. Власть в России захватили Советы, в которых решающее влияние имели большевики под руководством В. И. Ульянова (Ленина). Советская Россия стала первым в мире социалистическим государством. Столица была перенесена в Москву.",1,6,40,0.42523076923076925,0.07692307692307693
3849,Разрешено ли учение Иеговы в России?,22224#5,Свидетели Иеговы В 2017 году решением Верховного суда Российской Федерации деятельность религиозной организации «Управленческий центр Свидетелей Иеговы в России» и всех 395 местных религиозных организаций признана экстремистской и запрещена на территории России.,1,6,32,0.4253575757575758,0.06060606060606061
6520,К какой языковой группе принадлежит эстонский язык?,29312#0,"Эстонский язык Эсто́нский язы́к (самоназвание — ""eesti keel"") — язык эстонцев, относящийся к прибалтийско-финской ветви финно-угорской семьи языков. Официальный язык Эстонии и Европейского союза. Письменность на основе латинского алфавита.",1,7,29,0.42539354838709686,0.06451612903225806
3454,Гу́бки размножаются только половым путем?,25739#2,"Губки Размножаются половым и бесполым путём (в том числе с образованием покоящихся почек — геммул). Обладают высокой способностью к регенерации. Многие губки, а также населяющие их микроорганизмы вырабатывают биологически активные вещества, используемые в медицине.",1,5,34,0.4255783783783784,0.05405405405405406
1883,Когда Короле́вство Камбо́джа получило независимость?,2777#5,Камбоджа В 1953 году Камбоджа получила независимость.,1,5,7,0.42560000000000003,0.0
1336,Названа ли теорема по физике в честь Ама́лия Э́мми Нётер?,42283#0,"Теорема Нётер Теоре́ма Э́мми Нётер — теорема, доказанная Эмми Нётер в 1918 году. Была впервые определена в работах учёных гёттингенской школы Д. Гильберта, Ф. Клейна и самой Эмми Нётер.",1,10,29,0.4257000000000001,0.09375
1975,Когда Респу́блика Вануа́ту получила независимость?,21282#1,"Вануату Современное название страны, Вануату (буквально: «эта земля навсегда»), стало официально использоваться с 30 июля 1980 года, когда острова получили независимость от Великобритании и Франции.",1,5,25,0.4257142857142857,0.03571428571428571
1234,На берегу какой реки расположен Ирку́тск?,7708#1,"Иркутск Расположен в Восточной Сибири, на берегах реки Ангары, при впадении в неё реки Иркут (отсюда название города), в 66 км от Байкала. Климат резко континентальный со значительными перепадами температур. Из-за близости к сейсмически активному Байкальскому рифту регулярны слабые землетрясения.",1,6,40,0.42600000000000005,0.075
2368,Когда было самое крупное наводнение в Санкт-Петербу́рге?,32190#12,"Наводнения в Санкт-Петербурге Самым значительным и разрушительным наводнением за всю историю российского Санкт-Петербургa стало Петербургское наводнение 1824 года. До основания города крупнейшим было наводнение 1691 года, с подъёмом воды над ординаром 329 см (дата не указана).",1,7,36,0.42603076923076927,0.07692307692307693
1612,Какой месяц назван в честь Ю́лия Це́заря?,21051#6,"Юлианский календарь Цезарь переименовал месяц квинтилис (""Quintilis"") в свою честь, дав ему имя ""Iulius"" (июль). Впоследствии несколько императоров называли месяцы своими именами, но, помимо июля, лишь август, названный в честь преемника Цезаря, остался до сих пор.",1,7,36,0.42603076923076927,0.07692307692307693
2007,Где жил Минотавр?,52985#0,"Минотавр Минота́вр (, бык Миноса) — критское чудовище, человек-людоед с головой быка, живший в Лабиринте и убитый Тесеем.",1,3,18,0.4264,0.0
2399,Как называется столица Респу́блики Се́рбской?,21320#12,"Сербия Президент, правительство и Скупщина расположены в Белграде.",1,5,8,0.4264,0.0
1333,Когда умер Александр Солженицын?,53263#95,"Солженицын, Александр Исаевич Александр Солженицын скончался 3 августа 2008 года на 90-м году жизни в своём доме в Троице-Лыкове.
Смерть наступила в 23:45 по московскому времени от острой сердечной недостаточности.",1,4,30,0.4266666666666667,0.03333333333333333
2982,Где родился Чжэн Хэ?,37790#4,"Чжэн Хэ При рождении будущий мореплаватель получил имя Ма Хэ (馬 和). Он родился в деревне Хэдай, уезда Куньян. Уезд Куньян был расположен в центральной Юньнани, у южного берега озера Дяньчи, близ северного конца которого находится провинциальная столица Куньмин.",1,4,39,0.4266871794871795,0.05128205128205128
4823,Когда появилась ботаника как наука?,34718#1,"Ботаника Как стройная система знаний о растениях ботаника оформилась к XVII—XVIII векам, хотя многие сведения о растениях были известны и первобытному человеку, так как жизнь его была связана с полезными, главным образом пищевыми, лекарственными и ядовитыми растениями.",1,5,37,0.4267428571428572,0.05714285714285714
6319,Когда была организована Всемирная Организация Здравоохранения?,22180#0,"Всемирная организация здравоохранения Всеми́рная организа́ция здравоохране́ния (ВОЗ, ) — специальное учреждение Организации Объединённых Наций, состоящее из 194 государств-членов, основная функция которого лежит в решении международных проблем здравоохранения населения Земли. Она была основана в 1948 году со штаб-квартирой в Женеве в Швейцарии.",1,6,41,0.42680000000000007,0.075
477,В каком году Запорожье называлось Александровском?,21039#2,"Запорожье До 1921 г. город назывался Александровском по имени Александровской крепости, заложенной в 1770 г. Однозначной точки зрения, в честь кого была названа крепость нет. Называются имена генерал-фельдмаршала Александра Голицына, князя Александра Вяземского.",1,6,33,0.4268705882352941,0.058823529411764705
5153,Какой прибор измеряет направление ветра?,24334#0,"Анемометр Анемо́метр, ветроме́р (от  — ветер и  — измеряю) — прибор для измерения скорости движения газов, воздуха в системах, например, вентиляции. В метеорологии применяется для измерения скорости ветра.",1,5,28,0.42701538461538463,0.038461538461538464
3823,Как называется столица Калмыкии?,16005#0,"Калмыкия Респу́блика Калмы́кия (; краткое название: Калмыкия) — субъект Российской Федерации, республика в её составе. Входит в состав Южного федерального округа, является частью Поволжского экономического района. Столица — город Элиста.",1,4,30,0.4270967741935484,0.03225806451612903
3273,Как звали Фрейда?,57318#0,"Фрейд, Зигмунд Зи́гмунд Фрейд (правильная транскрипция — Фройд; так как , ; полное имя Сигизму́нд Шло́мо Фрейд, ; 6 мая 1856, Фрайберг, Австрийская империя — 23 сентября 1939, Лондон) — австрийский , , и .",1,3,35,0.4270967741935484,0.03225806451612903
3754,На какой высоте находится Тибет?,53346#6,Тибет Средняя высота территории: 4000 метров над уровнем моря.,1,5,9,0.4272,0.0
798,Есть в Мали выход к морю?,2834#0,"Мали Мали́ (), официально — Респу́блика Мали́ () — государство в Западной Африке, не имеющее выхода к морю. Граничит на западе с Сенегалом, на севере — с Мавританией и Алжиром, на востоке — с Нигером, на юго-востоке — с Буркина-Фасо, на юге — с Кот-д’Ивуаром и Гвинеей.",1,6,47,0.4273142857142857,0.08571428571428572
2265,Кто чаще страдает боле́знью Паркинсо́на: мужчины или женщины?,36261#11,"Болезнь Паркинсона Мужчины болеют несколько чаще, чем женщины. Существенных расовых различий в структуре заболеваемости не выявлено.",1,8,16,0.42740869565217393,0.043478260869565216
3750,Как умер пророк Моисей?,20677#3,"Моисей После 40 лет скитаний по пустыне и долгожданного прихода израильского народа на землю Ханаанскую, Моисей умер на горе Нево, которая находится на стороне нынешней Иордании, не входя в Землю Обетованную.",1,4,31,0.4274666666666667,0.03333333333333333
1508,Является ли Михаил Калашников Героем Российской Федерации?,32550#1,"Калашников, Михаил Тимофеевич Герой Российской Федерации (2009). Дважды Герой Социалистического Труда (1958, 1976). Лауреат Ленинской премии (1964) и Сталинской премии первой степени (1949). Кавалер ордена Святого апостола Андрея Первозванного (1998)",1,7,30,0.4277575757575758,0.06060606060606061
5753,Прага является столицей какой страны?,30050#0,"Прага Пра́га ( ) — статутный город и столица Чешской Республики, административный центр Среднечешского края и двух его районов: Прага-Восток и Прага-Запад. Образует самостоятельную административно-территориальную единицу страны.",1,5,27,0.4278068965517242,0.034482758620689655
1370,В каком театре работал Станиславский?,12116#1,"Станиславский, Константин Сергеевич В 1888 году стал одним из основателей Московского общества искусства и литературы. В 1898 году вместе с Вл. И. Немировичем-Данченко основал Московский Художественный театр.",1,5,27,0.4278068965517242,0.034482758620689655
