query_id,query,docid,passage,label,query_len,passage_len,difficulty,lexical_overlap
3486,"В каком году город Львов был одним из четырёх городов Украины, принимавших чемпионат Европы по футболу?",4321#4,"Львов В 2012 году был одним из четырёх городов Украины, принимавших чемпионат Европы по футболу.",1,16,15,0.18711111111111112,0.7222222222222222
3486,"В каком году город Львов был одним из четырёх городов Украины, принимавших чемпионат Европы по футболу?",2489#7,"Харьков В 2012 году был одним из четырёх городов Украины, принимавших Чемпионат Европы по футболу 2012.",1,16,16,0.23680000000000004,0.6
4780,Когда был спущен на воду первый броненосец в России?,84034#110,Броненосец Первый российский броненосец «Адмирал Лазарев» был в 1871 году спущен на воду в Санкт-Петербурге на Балтийском заводе.,1,9,18,0.2856941176470589,0.4117647058823529
4655,С какого года МГУ носит имя Михаила Васильевича Ломоносова?,7253#1,Московский государственный университет C 1940 года носит имя Михаила Васильевича Ломоносова.,1,9,11,0.3114666666666667,0.3333333333333333
462,Когда отмечается день города в Красногорске?,37060#6,Красногорск Городской праздник — День города Красногорска — традиционно отмечается в начале сентября.,1,6,13,0.32011428571428574,0.2857142857142857
2849,"Что нарисовала в сентябре 2014 года, к 12 летней годовщине трагической гибели Сергея Бодрова, граффити-команда из Витебска «HoodGraff» на стене трансформаторной будки?",45222#21,"Граффити В сентябре 2014 года, к 12 летней годовщине трагической гибели Сергея Бодрова, граффити-команда из Витебска «HoodGraff» нарисовала на стене трансформаторной будки портрет Сергея Бодрова в образе Данилы Багрова, расположено творение недалеко от Александро-Невской лавры, рядом с остановкой «Проспект Обуховской Обороны».",1,22,41,0.32567804878048784,0.4878048780487805
6001,Когда был впервые предложен термин Экосисте́ма?,10319#3,Экосистема В 1935 году современный термин экосистема впервые был предложен английским экологом А. Тенсли.,1,6,14,0.3285333333333334,0.26666666666666666
3869,Когда Греция вошла в НАТО?,11525#11,"НАТО В 1974 году Греция вышла, а в 1981 году вновь вошла в НАТО.",1,5,14,0.3388923076923077,0.23076923076923078
3183,Клод Э́лвуд Ше́ннон был аполитичным человеком?,14866#4,"Шеннон, Клод Шеннон, по собственным словам, был аполитичным человеком и атеистом.",1,6,11,0.3404923076923077,0.23076923076923078
3507,Какая была численность населения Одессы на 2019 год?,548#42,Эстония Численность населения на 1 января 2019 года — 1 323 824 человек.,1,8,13,0.34240000000000004,0.25
4848,В каком году был основан город Пермь?,1105#1,"Пермь Город основан в 1723 году, в 1940—1957 годах назывался Мо́лотов. В 1916 году в Перми был открыт первый на Урале университет.",1,7,22,0.35036190476190476,0.23809523809523808
2629,Какая частица по численности самая распространенная во Вселенной?,9061#4,Фотон Фотон — самая распространённая по численности частица во Вселенной. На один нуклон приходится не менее 20 миллиардов фотонов.,1,8,19,0.3519619047619048,0.23809523809523808
2763,Где родился Генрих Фольмер?,77321#1,"Фольмер, Генрих Родился года в Альтдорфе (округ Эсcлинген), умер года в Тюбингене.",1,4,12,0.3589333333333334,0.16666666666666666
38,В каком возрасте Беляев изобрел стереоскопический проекционный фонарь?,45471#3,"Беляев, Александр Романович В 16—18 лет изобрёл стереоскопический проекционный фонарь.",1,8,10,0.36000000000000004,0.2
3258,Где родился Николай Вавилов?,2756#4,"Вавилов, Николай Иванович Николай Иванович Вавилов родился года на Средней Пресне в Москве.",1,4,13,0.36486153846153846,0.15384615384615385
1812,В каком году родился Маркус Ниспел ?,74174#1,"Ниспель, Маркус Родился в 1964 году во Франкфурте, ФРГ. Больше всего известен его фильм ужасов «Техасская резня бензопилой».",1,7,18,0.3662095238095238,0.19047619047619047
1759,Как называется денежная единица в Казахстане?,6307#9,"Деньги В настоящее время тенге — денежная единица в Казахстане, а также разменная монета в Туркмении.",1,6,16,0.36621176470588235,0.17647058823529413
2677,Какая столица Конго?,4169#1,Республика Конго Столица — город Браззавиль.,1,3,6,0.3668,0.125
1155,Какой государственный язык Армении в 2019 году?,1817#3,Армения Столица — Ереван. Государственный язык — армянский.,1,7,8,0.36773333333333336,0.16666666666666666
4192,В какой день Германия напала на Советский союз в 1941?,38#21,"Союз Советских Социалистических Республик 22 июня 1941 года Германия напала на Советский Союз, нарушив подписанный ранее Договор о ненападении.",1,10,19,0.3682434782608696,0.21739130434782608
3696,Как называется столица Республики Дагестан?,13607#1,Дагестан Образована 20 января 1921 года как автономная республика в составе РСФСР. Столица республики — город Махачкала.,1,5,17,0.3704421052631579,0.15789473684210525
5098,Какая среднегодовая температура в Абхазии?,31089#9,Абхазия На побережье климат влажный субтропический. Количество осадков: 1300—2400 мм в год. Среднегодовая температура составляет: +15 °C.,1,5,17,0.3704421052631579,0.15789473684210525
17,В каком немецком городе родилась Екатерина 2?,13903#6,"Екатерина II София Фредерика Августа Ангальт-Цербстская родилась года в немецком городе Штеттине — столице Померании (ныне Щецин, Польша), в доме № 791 на Домштрассе ().",1,7,25,0.3710769230769231,0.19230769230769232
3329,В каком стиле был построен Воскресе́нский Новоиерусали́мский монасты́рь?,72456#35,Новоиерусалимский монастырь Интерьер церкви в середине XVIII века был переделан в стиле барокко.,1,8,13,0.37181176470588234,0.17647058823529413
379,Республика Дагестан - субъект Российской Федерации?,13607#0,"Дагестан Республика Дагеста́н (Дагестан) — субъект Российской Федерации (России), республика в eё составе. Входит в состав Северо-Кавказского федерального округа, является частью Северо-Кавказского экономического района.",1,6,24,0.3736347826086957,0.17391304347826086
2860,Деятельность мозжечка контролируется сознанием?,13876#2,"Мозжечок Хоть мозжечок и связан с корой головного мозга, его деятельность не контролируется сознанием.",1,4,14,0.3738666666666667,0.13333333333333333
2860,Деятельность мозжечка контролируется сознанием?,13876#75,"Мозжечок Хотя мозжечок и связан с корой головного мозга, его деятельность не контролируется сознанием.",1,4,14,0.3738666666666667,0.13333333333333333
6582,Какая столица Швеции?,727#2,Швеция Столица — Стокгольм. Государственный язык — шведский.,1,3,8,0.3739555555555556,0.1111111111111111
3591,Когда установилась диктатура Франко в Испании?,18394#26,"Франко, Франсиско С 1939 года в Испании установилась диктатура Франко, просуществовавшая до ноября 1975 года. Испанская республика пала.",1,6,18,0.3784,0.15
750,Когда Михаи́л Дми́триевич Ско́белев стал генералом от инфантерии?,25692#0,"Скобелев, Михаил Дмитриевич Михаи́л Дми́триевич Ско́белев ( — ) — российский военачальник и стратег, генерал от инфантерии (1881), генерал-адъютант (1878).",1,8,20,0.3784347826086957,0.17391304347826086
3860,Сколько процентов украинского населения считает себя приверженцами Украи́нской правосла́вной це́ркви Согласно данным социологического исследования Центра Разумкова на апрель 2018 года?,16065#2,"Украинская православная церковь (Московского патриархата) Согласно данным социологического исследования Центра Разумкова на апрель 2018 года прихожанами УПЦ МП считают себя 12,8 % опрошенных украинцев.",1,20,24,0.3815529411764706,0.29411764705882354
3733,Какая площадь города Новомоско́вск?,89129#1,"Новомосковск (Россия) Численность населения — чел. (). Площадь города без прилегающих сельских территорий — 74,7 км².",1,4,16,0.38174117647058825,0.11764705882352941
4590,"Когда был основан хоккейный клуб ""Металлург""?",54161#1,"Металлург (хоккейный клуб, Магнитогорск) Клуб был основан в 1955 году. В настоящее время «Металлург» выступает в Дивизионе Харламова Восточной конференции.",1,6,20,0.3828571428571429,0.14285714285714285
250,Какая столица Ирака?,2800#1,Ирак Столица — Багдад. Официальные языки — арабский и курдский.,1,3,10,0.38363636363636366,0.09090909090909091
3185,Какая столица Афганистана?,1116#1,Афганистан Столица — Кабул. Государственные языки — пушту и дари.,1,3,10,0.38363636363636366,0.09090909090909091
4791,Когда была создана первая компьютерная игра в мире?,85863#2,История компьютерных игр 1940 — самая первая компьютерная игра и самый первый игровой автомат Nimatron.,1,8,15,0.384,0.15
4347,Сколько островов в Японии?,23940#0,"Список островов Японии Островное государство Япония расположено целиком на островах в Тихом океане, которых насчитывается 6852.",1,4,16,0.38435555555555556,0.1111111111111111
240,Когда была зарегистрирована партия «Яблоко»?,14761#9,Яблоко (партия) 26 апреля 2002 года Минюстом была зарегистрирована Российская демократическая партия «Яблоко» (Рег. № 5018). Председателем был избран Григорий Явлинский.,1,5,21,0.38462608695652173,0.13043478260869565
4530,Был ли календарь в Древней Мессопотамии?,52695#0,Шумерский календарь Шумерский календарь — календарь шумеров.,1,6,7,0.3851555555555556,0.1111111111111111
4377,Когда изгнали последнего мавританского властителя с Пиренейского полуострова?,44321#3,"Реконкиста Завершилась реконкиста в 1492 году, когда Фердинанд II Арагонский и Изабелла I Кастильская изгнали последнего мавританского властителя с Пиренейского полуострова. Они объединили бо́льшую часть Испании под своей властью (Королевство Наварра было включено в состав Испании в 1512 году).",1,8,39,0.3854222222222222,0.19444444444444445
3740,В какой список внесен исторический центр Львова?,4321#88,"Львов В 1998 году исторический центр города и собор святого Юра внесены в список всемирного наследия ЮНЕСКО, чему активно способствовал городской голова Василий Куйбида.",1,7,24,0.3856615384615385,0.15384615384615385
1768,На какой реке расположена Москва?,71#2,"Москва Расположена на реке Москве в центре Восточно-Европейской равнины, в междуречье Оки и Волги. Как субъект федерации Москва граничит с Московской и Калужской областями.",1,5,24,0.38702608695652174,0.13043478260869565
486,Сколько официальных языков в Белоруссии на март 2019?,4258#11,Белорусский язык Белорусский язык является государственным в Белоруссии наряду с русским.,1,8,11,0.3874666666666667,0.13333333333333333
4320,Какая столица Косово?,15184#0,Республика Косово Столица — Приштина. Государственные языки — албанский и сербский.,1,3,11,0.3874666666666667,0.08333333333333333
3299,Сколько раз Бразилия выигрывала чемпионат мира по футболу?,41440#32,"Чемпионат мира по футболу Самая титулованная сборная чемпионатов мира — Бразилия. Бразилия — единственная в мире сборная, участвовавшая в финальных турнирах всех чемпионатов мира, при этом она 5 раз выигрывала чемпионат и ещё дважды была финалистом.",1,8,36,0.3880727272727273,0.18181818181818182
5175,На каком языке говорят в Южной Осетии?,9544#38,"Южная Осетия Осетинский язык — основной язык населения Южной Осетии. На осетинском языке вещает центральное телевидение, выходит газета «Хурзæрин».",1,7,19,0.3886545454545455,0.13636363636363635
3622,Какая столица Черногории в 2018 году?,21595#3,Черногория Столица и крупнейший город — Подгорица. Исторической и культурной столицей Черногории является город Цетине.,1,6,15,0.38894117647058823,0.11764705882352941
4204,Как звали бога морей в Древней Греции?,21972#1,"Гиппокампус (мифология) Морские божества в Древней Греции и Риме часто изображались на колесницах, запряженных гиппокампами. В частности, гиппокампы были запряжены в колесницу греческого бога морей Посейдона.",1,7,26,0.3895407407407408,0.14814814814814814
4418,Кто написал гимн Белоруссии?,22117#4,"Гимн Республики Беларусь ""Слова М. Климковича""
""Музыка Н. Соколовского""",1,4,9,0.3898666666666667,0.08333333333333333
4438,Где заседает Верховная Рада Украины?,25549#27,"Верховная рада Верховная Рада заседает в Доме Верховного Совета Украины — здании неоклассической архитектуры в Киеве. Оно соседствует с Мариинским дворцом, являющимся церемониальной резиденцией президента.",1,5,25,0.39,0.125
6354,Какое место по площади занимает Киргизия среди стран СНГ на сегодняшний день?,2823#2,"Киргизия По площади территории страна занимает 85-е место в мире (199 951 км²), 7-е место среди стран СНГ. Киргизия простирается от Ферганской долины на западе до центральной части Тянь-Шаня на востоке, от Казахстана на севере до Памиро-Алая на юге.",1,12,39,0.3903111111111111,0.2222222222222222
1901,Что является возбудителем чумы?,26598#2,"Чума Возбудителем является чумная палочка (), открытая в июне 1894 года французом Александром Йерсеном и японцем Китасато Сибасабуро.",1,4,18,0.3904,0.1
373,Какая средняя дальность полёта небоевой стрелы из лука?,59890#1,"Лук (оружие) Дальность полёта стрелы зависит от конструкции лука, силы натяжения тетивы и погоды; в среднем составляет до 250 метров для небоевой стрелы.",1,8,23,0.3911407407407408,0.14814814814814814
4141,Когда пришло к власти Вре́менное прави́тельство в России?,20563#0,Временное правительство России Вре́менное прави́тельство ( — а) — высший исполнительно-распорядительный и законодательный орган государственной власти в России в период между Февралём и Октябрём 1917 года.,1,8,26,0.3912615384615385,0.15384615384615385
4212,Где Маркс познакомился с Энгельсом?,14109#22,"Маркс, Карл 28 августа 1844 года Маркс познакомился с немецким социалистом Фридрихом Энгельсом в Кафе де ля Режанс; они стали друзьями на всю жизнь.",1,5,24,0.3930461538461539,0.11538461538461539
1152,Какая площадь Могадишо?,46118#1,Могадишо Население города — 2 120 000 жителей (2015). Площадь — 91 км².,1,3,13,0.3938285714285714,0.07142857142857142
3661,Как называется денежная единица Болгарии?,46213#0,"Болгарский лев Лев, ""устар."" лёв () — денежная единица Болгарии, содержит 100 стотинок. Код ISO 4217 — BGN.",1,5,18,0.39440000000000003,0.1
2036,В каком году была создана система WebMoney?,19982#38,"WebMoney Компания была создана в 1998 году, первая тысяча зарегистрированных пользователей системы была премирована 30 WMZ (тогда они назывались просто WM).",1,7,21,0.39480000000000004,0.125
4065,К какой группе языков принадлежит армянский язык?,29882#0,"Армянский язык Армя́нский язы́к (հայերէն, հայերեն, []) — язык армян, относящийся к индоевропейской семье языков и выделяемый в ней в особую ветвь.",1,7,22,0.39560000000000006,0.125
410,Когда был изобретен первый электромобиль?,19112#1,"Электромобиль Электромобиль появился раньше, чем двигатель внутреннего сгорания. Первый электромобиль в виде тележки с электромотором был создан в 1841 году.",1,5,20,0.396,0.1
4418,Кто написал гимн Белоруссии?,22117#2,"Гимн Республики Беларусь ""Слова М. Климковича, В. Каризны""
""Музыка Н. Соколовского""",1,4,11,0.39622857142857143,0.07142857142857142
394,Сколько лет живет бук?,635#10,"Бук Буки растут медленно, но живут до 400 лет и более.",1,4,11,0.39622857142857143,0.07142857142857142
1480,Сколько лет правил царь Хаммурапи?,46837#0,"Хаммурапи Хаммура́пи — царь Вавилона, правил приблизительно в 1793—1750 годах до н. э., из I Вавилонской (аморейской) династии.",1,5,18,0.39630476190476194,0.09523809523809523
2201,Кто был первым чемпионом мира по шахматам?,19435#0,Чемпионы мира по шахматам Первым официальным чемпионом мира по шахматам стал Вильгельм Стейниц в 1886 году. С 1948 года организацией матчей за первенство мира стала заниматься Международная шахматная федерация (ФИДЕ).,1,7,30,0.39682758620689657,0.13793103448275862
2008,Чему равна сумма квадратов катетов в прямоугольном треугольнике?,14541#0,"Теорема Пифагора Теоре́ма Пифаго́ра — одна из основополагающих теорем евклидовой геометрии, устанавливающая соотношение между сторонами прямоугольного треугольника: сумма квадратов длин катетов равна квадрату длины гипотенузы.",1,8,25,0.39682758620689657,0.13793103448275862
4390,Какая столица Польши в 2018 году?,58#1,Польша Столица — Варшава. Государственный язык — польский.,1,6,8,0.3970666666666667,0.08333333333333333
