query_id,query,docid,passage,label,query_len,passage_len,difficulty,lexical_overlap
990,Какая длина улицы Арбат?,34641#1,"Арбат Улица Арбат проходит от площади Арбатские ворота до Смоленской площади, лежит между улицей Пречистенкой и улицей Новый Арбат. Нумерация домов ведётся от площади Арбатские ворота. Протяжённость Арбата составляет 1,2 километра.",1,4,31,0.4408,0.0
3419,Сколько есть видов губок?,25739#0,"Губки Гу́бки  — тип водных (преимущественно морских) многоклеточных животных, ведущих прикреплённый образ жизни. Распространены по всему земному шару от прибрежной зоны и до почти максимальных глубин океана. Насчитывают около 8000 видов.",1,4,31,0.4408,0.0
6064,Когда был введен евро?,4207#1,"Евро Евро был введён в безналичное обращение 1 января 1999 года, а 1 января 2002 года были введены в наличное обращение банкноты и монеты. Евро заменил в соотношении 1:1 европейскую валютную единицу (ЭКЮ), которая использовалась в европейской валютной системе с 1979 по 1998 год.",1,4,44,0.44094358974358977,0.02564102564102564
3966,Когда началась Шестидневная война?,43925#0,"Шестидневная война Шестидневная война (, ""Мильхемет Шешет ѓа-Йамим""; , ""Ḥarb al‑Ayyam as‑Sitta"" или , ""Ḥarb 1967"", ) — война на Ближнем Востоке между Израилем с одной стороны и Египтом, Сирией, Иорданией, Ираком и Алжиром с другой, продолжавшаяся с 5 по 10 июня 1967 года.",1,4,44,0.44094358974358977,0.02564102564102564
363,Существует ли обряд самосожжения вдов в Индии в 2019 году?,68921#63,"Самоубийство В Индии до настоящего времени действует закон, согласно которому попытка самоубийства наказывается лишением свободы на срок до 1 года и/или штрафом. Ранее в индийской традиции было принято самосожжение вдов.",1,10,30,0.44114285714285717,0.05714285714285714
4751,Какая площадь города Мумбаи?,52609#1,"Мумбаи Мумбаи — : в понятие города включают т. н. муниципальную корпорацию Мумбаи, в состав которой входят два дистрикта штата Махараштра: собственно «Мумбаи» (157 км², ), а также дистрикт «Мумбаи (пригородный)» (446 км², ), всего 603 км², . Вместе с городами-спутниками образует с .",1,4,44,0.44120000000000004,0.025
588,"Когда родился А́ртур Уэ́лсли, 1-й герцог Ве́ллингтон?",56577#0,"Веллингтон, Артур Уэлсли А́ртур Уэ́лсли, 1-й герцог Ве́ллингтон (; 1 мая 1769, Дунканкестл — 14 сентября 1852, Лондон) — британский полководец и государственный деятель, фельдмаршал (3 июля 1813), участник Наполеоновских войн, победитель при Ватерлоо (1815). 25-й (с 22 января 1828 по 22 ноября 1830) и 28-й (с 17 ноября по 10 декабря 1834) премьер-министр Великобритании.",1,7,55,0.44123076923076926,0.07692307692307693
2911,В каком году был убит Киров?,20430#0,"Киров, Сергей Миронович Серге́й Миро́нович Ки́ров (настоящая фамилия Ко́стриков) (15 (27 марта) 1886, Уржум, Вятская губерния — 1 декабря 1934, Ленинград) — российский революционер, советский государственный и политический деятель. 1 декабря 1934 года был убит Леонидом Николаевым. Убийство Кирова послужило поводом для начала массовых репрессий в СССР, известных как «Большой террор».",1,6,51,0.4412705882352941,0.058823529411764705
5142,Как назывался первый искусственный спутник Земли?,16083#0,"Спутник-1 «Спу́тник-1» — первый искусственный спутник Земли, советский космический аппарат, запущенный на орбиту 4 октября 1957 года. Кодовое обозначение спутника — «ПС-1» («Простейший Спутник-1»). Запуск был осуществлён с 5-го научно-исследовательского полигона Министерства обороны СССР «Тюра-Там» (получившего впоследствии открытое наименование космодром «Байконур») на ракете-носителе «Спутник», созданной на базе межконтинентальной баллистической ракеты «Р-7».",1,6,51,0.4412705882352941,0.058823529411764705
5658,Когда был запущен первый спутник Земли?,16083#0,"Спутник-1 «Спу́тник-1» — первый искусственный спутник Земли, советский космический аппарат, запущенный на орбиту 4 октября 1957 года. Кодовое обозначение спутника — «ПС-1» («Простейший Спутник-1»). Запуск был осуществлён с 5-го научно-исследовательского полигона Министерства обороны СССР «Тюра-Там» (получившего впоследствии открытое наименование космодром «Байконур») на ракете-носителе «Спутник», созданной на базе межконтинентальной баллистической ракеты «Р-7».",1,6,51,0.4412705882352941,0.058823529411764705
1258,Когда был открыт район Сокол в Москве?,30117#41,"Сокол (район Москвы) Одной из достопримечательностей района является жилой посёлок «Сокол», известный также как «Посёлок художников». Он был основан в начале 20-х годов прошлого века. Комплекс зданий посёлка является памятником архитектуры регионального значения. Посёлок «Сокол» занимает площадь в 20 гектаров в районе пересечения улицы Алабяна и Волоколамского шоссе.",1,7,48,0.4414,0.0625
5438,Когда была созвана первая Государственная Дума?,21893#1,"Государственная дума Российской империи Манифестом от 6 августа 1905 года император Николай II учредил Государственную думу как ""«особое законосовещательное установление, коему предоставляется предварительная разработка и обсуждение законодательных предположений и рассмотрение росписи государственных доходов и расходов»"".",1,6,35,0.44147368421052635,0.02631578947368421
2925,Когда был основан Ишимбай?,75175#5,"Ишимбай Возникновение и экономическое развитие Ишимбая связано с открытием нефтяных месторождений — образованием Второго Баку. Корни города восходят к деревне Ишимбаево, основанной в 1815 году Ишимбаем Акбердиным. В его честь назван город.",1,4,32,0.4416,0.0
904,Как появился термин Перестройка?,44#4,"Перестройка 15 — 17 мая 1985 года состоялась поездка генерального секретаря ЦК КПСС Горбачёва в Ленинград, где на встрече с активом Ленинградского горкома партии он впервые заговорил о необходимости перестройки общественно-политической жизни:",1,4,32,0.4416,0.0
3831,Откуда родом Земфира?,14132#0,"Земфира Земфира (полное имя Земфи́ра Талга́товна Рамаза́нова, ; род. , Уфа, Башкирская АССР, РСФСР, СССР) — российская рок-певица, музыкант, композитор, продюсер и автор песен. Земфира стала олицетворением нового движения в русском роке, которое журналисты окрестили «женский рок».",1,3,37,0.4416,0.0
2524,Какая высота Кёльнского собора?,23859#1,Кёльнский собор Строительство главного храма Кёльнской архиепископии велось в два приёма — в 1248—1437 гг. и в 1842—1880 годах. По окончании строительства 157-метровый собор на четыре года стал самым высоким зданием мира.,1,4,32,0.4416,0.0
1243,Кто такой Менделеев?,1461#23,"Менделеев, Дмитрий Иванович Д. И. Менделеев — автор фундаментальных исследований по химии, физике, метрологии, метеорологии, экономике, основополагающих трудов по воздухоплаванию, сельскому хозяйству, химической технологии, народному просвещению и других работ, тесно связанных с потребностями развития производительных сил России.",1,3,37,0.4416,0.0
4831,Кто такой митрополит?,18728#0,"Митрополит Митрополи́т () — первый по древности епископский титул в христианской Церкви. Первоначально титул митрополита носили епископы христианских церквей, резиденции — ""кафедры"" — которых находились в главных городах (метрополиях — ) — административных центрах провинций Римской империи.",1,3,37,0.4416,0.0
6091,Где родился Гауди?,3192#0,"Гауди, Антонио Анто́ни Пла́сид Гильéм Гауди́-и-Корне́т (также Анто́нио; , ; 25 июня 1852, Реус, Каталония — 10 июня 1926, Барселона) — каталонский архитектор, большинство проектов которого, включая самую масштабную его постройку, храм Святого Семейства, возведено в Барселоне.",1,3,37,0.4416,0.0
1518,Что открыл Коперник?,1299#0,"Коперник, Николай Никола́й Копе́рник (, , ; 19 февраля 1473, Торунь — 24 мая 1543, Фромборк) — польский , , , , каноник эпохи Возрождения. Наиболее известен как автор гелиоцентрической системы мира, положившей начало первой научной революции.",1,3,37,0.4416,0.0
4870,Когда правила Екатериной II?,13903#0,"Екатерина II Екатери́на II Алексе́евна Вели́кая (урождённая Софи́я Авгу́ста Фредери́ка А́нгальт-Це́рбстская, , в православии ""Екатерина Алексе́евна""; , Штеттин, Пруссия — , Зимний дворец, Петербург) — императрица Всероссийская с 1762 по 1796 год.",1,4,32,0.4416,0.0
1079,К какой языковой группе относится малазийский язык?,75022#0,"Малайский язык Мала́йский, или малайзи́йский язы́к (самоназвание: "") — один из австронезийских языков (малайско-полинезийская ветвь, западная «подветвь»).",1,7,17,0.44160000000000005,0.0
349,В каком году родился Борис Заходер?,61438#0,"Заходер, Борис Владимирович Бори́с Влади́мирович Заходе́р (9 сентября 1918, Кагул, Бессарабия — 7 ноября 2000, Москва) — советский и российский детский прозаик, поэт, переводчик, сценарист. Популяризатор мировой детской классики. Лауреат Государственной премии Российской Федерации (1999).",1,6,35,0.44174358974358974,0.02564102564102564
3388,В Переделкине жил Борис Пастернак?,51134#21,"Пастернак, Борис Леонидович В 1936 году поселяется на даче в Переделкине, где с перерывами проживёт до конца жизни. С 1939 по 1960 год живёт на даче по адресу: улица Павленко, 3 (сейчас мемориальный музей). Его московский адрес в писательском доме с середины 1930-х до конца жизни: Лаврушинский переулок, д.17/19, кв.72.",1,5,50,0.44181818181818183,0.045454545454545456
3358,Когда родился Садда́м Хусе́йн?,9304#4,"Саддам Хусейн Саддам Хусейн родился 28 апреля 1937 года в селении Аль-Ауджа в 13 км от иракского города Тикрит, в семье безземельного крестьянина. Его мать, Сабха Тулфан аль-Муссалат (Сабха Тульфах или Субха), назвала новорождённого «Саддам» (в одном из значений по-арабски это «тот, кто противостоит»).",1,4,44,0.44189767441860467,0.023255813953488372
151,Сколько городов на Украине?,732#133,"Украина На Украине насчитывается 490 районов, 459 городов, 885 посёлков городского типа и 28 450 сёл и прочих населённых пунктов.
""Автономная Республика Крым"", согласно Конституции Украины, является её неотъемлемой составляющей частью и в пределах полномочий, определённых Конституцией Украины, решает вопросы, отнесённые к её ведению.",1,4,44,0.44189767441860467,0.023255813953488372
4300,Когда родился Митрида́т VI Евпатор?,19031#0,"Митридат VI Митрида́т VI Евпатор (, ) или Митридат Понтийский — латинизированная форма, также имевший прозвища Дионис () и Великий; 132 до н. э., Синоп, Понтийское царство — 63 до н. э., Пантикапей, Боспорское царство — царь Понта, правивший в 120—63 годы до н. э. Августин называет Митридата «царём Азии» ()",1,5,51,0.44219534883720935,0.046511627906976744
1028,Есть ли аэропорт в Астрахани?,20673#64,"Астрахань В 16 км северо-западнее аэропорта Астрахань находится военный аэродром Приволжский. С 1963 по 1979 годы он являлся основным аэропортом Астрахани. К юго-востоку от города Астрахань имеются два спортивных аэродрома Осыпной Бугор и Три Протока.
В Астрахани работают 5 театров:",1,5,40,0.4422439024390244,0.024390243902439025
4698,Кто такой надворный советник?,53540#0,"Надворный советник Надво́рный сове́тник — гражданский чин VII класса в Табели о рангах в России. Соответствовал чинам подполковника в армии, войскового старшины у казаков и капитана II ранга. Официальное обращение: «Ваше высокоблагородие». Знаками различия данного чина являлись двухпросветные петлицы, или погоны с тремя звёздами.",1,4,44,0.44231111111111115,0.022222222222222223
3711,Когда родился Виктор Пелевин?,21237#0,"Пелевин, Виктор Олегович Ви́ктор Оле́гович Пеле́вин (род. 22 ноября 1962, Москва) — русский писатель, автор культовых романов 1990-х годов: «Омон Ра», «Чапаев и Пустота» и «Generation „П“». Лауреат многочисленных литературных премий, среди которых «Малый Букер» (1993), «Национальный бестселлер» (2004) и премия Андрея Белого (2017).",1,4,44,0.44231111111111115,0.022222222222222223
3388,В Переделкине жил Борис Пастернак?,51134#81,"Пастернак, Борис Леонидович В 1990 году, в год 100-летия со дня рождения поэта, музей Пастернака открыл свои двери в Чистополе, в доме, где поэт жил в эвакуации в годы Великой Отечественной войны (1941—1943), и в Переделкине, где он жил долгие годы вплоть до своей смерти. Директор дома-музея поэта — Наталья Пастернак, приходящаяся ему невесткой (вдова младшего сына Леонида).",1,5,58,0.4424,0.06
1607,Где живут эскимосы?,43413#0,"Эскимосы Эскимо́сы (эскимос. ᐃᓄᐃᑦ) — группа коренных народов, составляющая коренное население территории от Гренландии и Нунавута (Канада) до Аляски (США) и восточного края Чукотки (Россия). Численность — около 170 тысяч человек. Языки относятся к эскимосской ветви эскимосско-алеутской семьи.",1,3,38,0.4424,0.0
4594,Используют мантру при медитации?,42523#2,"Мантра Медитация с повторением мантры может помочь вызывать измененное состояние сознания. Мантра может иметь синтаксическую структуру или буквальное значение, но может быть лишена и того, и другого. Много мантр — на ведическом санскрите.",1,4,33,0.4424,0.0
5565,Когда была создана Еврейская автономная область СССР?,10020#0,"Еврейская автономная область Евре́йская автоно́мная о́бласть ( ""yidishe oytonome Gegent"") — субъект Российской Федерации, входит в состав Дальневосточного федерального округа. Административный центр — город Биробиджан. Образована 7 мая 1934 года. Граничит на юге с Китаем (по реке Амур), на западе — с Амурской областью, на востоке — с Хабаровским краем.",1,7,50,0.442468085106383,0.06382978723404255
5981,В каком городе родился Вацлав Клаус?,51324#0,"Клаус, Вацлав Вацлав Клаус (; род. 19 июня 1941 года, Прага) — второй президент Чехии (2003—2013 годы), ранее бывший её премьер-министром, один из наиболее влиятельных чешских политиков, почётный профессор МГУ. Является одним из самых известных евроскептиков.",1,6,36,0.44254358974358976,0.02564102564102564
4025,Является ли бокс Олимпийским видом спорта?,3640#71,"Узбекистан Бокс также является одним из самых популярных видов спорта в Узбекистане. Узбекистан имеет четыре олимпийских чемпионов, обладателей двух серебряных и восьми бронзовых медалей Олимпийских игр по этому виду спорта. Также страна имеет ещё больше обладателей медалей по боксу в Азиатских играх, на Чемпионатах Азии и мира.",1,6,47,0.4425523809523809,0.047619047619047616
4152,Кто убил Усама бен Ладена?,44966#2,"Усама бен Ладен В 2001—2011 годах являлся главной целью Войны против терроризма, за информацию о его местонахождении ФБР назначило награду в 25 миллионов долларов. 2 мая 2011 года Усама бен Ладен был ликвидирован в ходе операции американских спецподразделений по приказу президента США Барака Обамы в собственном убежище в пакистанском Абботтабаде.",1,5,50,0.4426086956521739,0.043478260869565216
3625,Сколько дней в календаре майя?,45258#6,"Календарь майя Цольки́н, или тцолки́н () — ритуальный период в 260 дней, являющийся комбинацией периодов по 20 и 13 дней.
Каждый день имеет номер от 1 до 13, кроме того, у дней есть названия, повторяющиеся с периодом 20. Каждому названию дня соответствует свой символ, так называемая Солнечная Печать.",1,5,48,0.4427137254901961,0.0392156862745098
5637,В каком городе родился Николай Коперник?,1299#0,"Коперник, Николай Никола́й Копе́рник (, , ; 19 февраля 1473, Торунь — 24 мая 1543, Фромборк) — польский , , , , каноник эпохи Возрождения. Наиболее известен как автор гелиоцентрической системы мира, положившей начало первой научной революции.",1,6,37,0.4427891891891892,0.02702702702702703
